{
  "schemaVersion": 1,
  "experimentId": "GS-OSS-2026-08-05-EFFECT-R2",
  "revision": 2,
  "evidenceClass": "external-observational",
  "taskId": "TASK-OSS-13",
  "repository": "vitejs/vite",
  "upstream": {
    "repositoryUrl": "https://github.com/vitejs/vite.git",
    "pullRequestUrl": "https://github.com/vitejs/vite/pull/23135",
    "baseCommit": "1331b0b438b1e7193effb7d2341660bccb9c3155",
    "fixCommit": "b4bf59686a7ac238929e91a6e1708c739b843a2f",
    "baseReachable": true,
    "fixReachable": true,
    "fixGitTree": "2b472c4863dac8b00e0b6c3ea9bcab414e8ac47f"
  },
  "seed": {
    "sealedSeedCommit": "1331b0b438b1e7193effb7d2341660bccb9c3155",
    "sealedSeedGitTree": "e94e68902fd6c7db705af5c52c508c452ea9dca6",
    "sealedSeedTreeSha256": "e295934d2f20bd34dcc6edeb81e2dc2799b061345e2d3c9289536deb24aad104",
    "overlayApplied": false
  },
  "publicTask": {
    "path": "benchmarks/external-oss-effectiveness-r2/tasks/TASK-OSS-13/public-task.md",
    "sha256": "83635829c388f80341dfd2250871b75bae4e35e2870a1d22c12178497da0d2f7"
  },
  "publicTest": {
    "path": "benchmarks/external-oss-effectiveness-r2/tasks/TASK-OSS-13/public-test.ts",
    "sha256": "fd5d4b9e358c75197a5bd8564de7c94067eeab138f231c07fd3d8664a584033f",
    "command": [
      "pnpm",
      "exec",
      "tsx",
      "/public-test/public-test.ts"
    ],
    "commandIdentitySha256": "990221221b2ef8bd41e92e967026040307141b03007bb90230fab7cb4ecb4b64",
    "parent": {
      "commit": "1331b0b438b1e7193effb7d2341660bccb9c3155",
      "exitCode": 1,
      "status": "FAIL_EXPECTED"
    },
    "fix": {
      "commit": "b4bf59686a7ac238929e91a6e1708c739b843a2f",
      "exitCode": 0,
      "status": "PASS"
    }
  },
  "pathPolicy": {
    "allowOnly": true,
    "allowedPaths": [
      "packages/vite/src/node/build.ts"
    ],
    "forbiddenPaths": [
      ".github/**",
      "tests/**",
      "testing/**",
      "**/tests/**",
      "**/node_modules/**",
      "**/.venv/**",
      "credentials/**",
      "/public-test/**",
      "/runner-private/**"
    ],
    "sha256": "8674c255d344b3008ffde9cd7e4a92184dde5d5440562d5b5564fe408d00df92"
  },
  "hiddenOracle": {
    "sha256": "422ea10fd78ddb0141014002574a1af87995bea76e9e7c0d552f599e48a77a11",
    "commandIdentitySha256": "9513a023765daa5de37934aa1c82b09f7a1d287db46be56bf4bc3b1722cdd4c3",
    "runnerOwned": true,
    "sourceCommitted": false,
    "exposedToExecutionAgent": false,
    "identitySeparatedFromPublicTest": true,
    "parent": {
      "commit": "1331b0b438b1e7193effb7d2341660bccb9c3155",
      "exitCode": 1,
      "status": "FAIL_EXPECTED"
    },
    "fix": {
      "commit": "b4bf59686a7ac238929e91a6e1708c739b843a2f",
      "exitCode": 0,
      "status": "PASS"
    }
  },
  "reconstruction": {
    "mode": "exact-upstream-parent",
    "exactShaFetchVerified": true,
    "runs": [
      {
        "ordinal": 1,
        "sealedSeedCommit": "1331b0b438b1e7193effb7d2341660bccb9c3155",
        "sealedSeedGitTree": "e94e68902fd6c7db705af5c52c508c452ea9dca6",
        "sealedSeedTreeSha256": "e295934d2f20bd34dcc6edeb81e2dc2799b061345e2d3c9289536deb24aad104"
      },
      {
        "ordinal": 2,
        "sealedSeedCommit": "1331b0b438b1e7193effb7d2341660bccb9c3155",
        "sealedSeedGitTree": "e94e68902fd6c7db705af5c52c508c452ea9dca6",
        "sealedSeedTreeSha256": "e295934d2f20bd34dcc6edeb81e2dc2799b061345e2d3c9289536deb24aad104"
      }
    ],
    "stable": true,
    "status": "PASS"
  },
  "runtime": {
    "language": "TypeScript",
    "runtimeVersion": "Node.js v26.3.0; pnpm 10.34.5",
    "dependencyInstallCommand": [
      "pnpm",
      "install",
      "--frozen-lockfile",
      "--ignore-scripts",
      "--filter",
      "vite..."
    ],
    "preTestCommand": [
      "pnpm",
      "--filter",
      "vite",
      "build-bundle"
    ],
    "environment": {},
    "publicTestWorkingDirectory": "."
  },
  "status": "PASS",
  "claimBoundary": "Offline public-repository task preparation only. This receipt is not formal lock, provider execution, Pilot, confirmatory, scoring, effectiveness, or acceptance evidence."
}
